matricule,name,cisco,studied_at,observation,mention,option
85726-QGGP,Raharinaivo Tojo Herilala Hery,Mahajanga,School_4,non admis,passable,A2
82310-LWWX,Raharinaivo Andry Tojo Haja,Antananarivo,School_39,non admis,passable,A2
39935-ZCAF,Randrianarivelo Tovo Soa,Morondava,School_61,admis,passable,A2
82571-AMAX,Raharinaivo Fanilo Fitiavana,Antananarivo,School_21,admis,passable,A2
65080-UKAF,Rakotoarisoa Tovo Fitiavana Soa Miangaly,Farafangana,School_55,non admis,passable,A1
78077-JPZJ,Randrianarivelo Herilala Mamy Hery,Fianarantsoa,School_22,admis,passable,A1
74856-HPRO,Randria Rina Soa Andry Hery,Morondava,School_35,admis,passable,C
82489-HIWJ,Rasolofoson Rina Fitiavana Soa,Antsiranana,School_83,non admis,passable,A1
96474-GRRN,Rakotoarisoa Hery Fanilo Haja,Antsiranana,School_8,non admis,passable,A2
82939-MNVT,Rakotomamonjy Tiana Fanilo,Antananarivo,School_49,non admis,passable,D
34620-FGZO,Andrianarivo Soa Finaritra,Toamasina,School_25,non admis,passable,A1
21373-NUEG,Randrianarivelo Finaritra Andry Herilala,Antananarivo,School_99,non admis,passable,A2
31933-IOTE,Rasolofo Haja Tojo Rina Andry,Toamasina,School_74,admis,passable,D
12929-ECCK,Raharinaivo Hasina Tovo,Mahajanga,School_8,admis,passable,L
78321-ZDUK,Rakotoarisoa Andry Tojo Herilala Finaritra,Ambatondrazaka,School_6,admis,passable,A1
76344-MJYX,Raharinaivo Hasina Tojo Miangaly,Toamasina,School_12,non admis,bien,L
41780-RGAD,Rakotoarisoa Fitiavana Andry,Antsirabe,School_92,non admis,assez bien,A2
22232-BRPC,Andrianarivo Hery Miangaly,Toliara,School_13,non admis,passable,OSE
93070-CRGY,Andrianarivo Hasina Rina,Antsiranana,School_60,non admis,passable,A2
39927-DZXV,Rasolofo Andry Tovo Mamy,Toliara,School_78,non admis,passable,A1
10795-EMLY,Rasolofo Rina Fanilo Miangaly Tovo,Antsiranana,School_26,non admis,passable,S
85501-UPWS,Randria Fitiavana Finaritra Rina,Fianarantsoa,School_61,non admis,bien,A1
46503-POWI,Randria Mamy Fanilo Haja Rina,Mananjary,School_57,admis,bien,S
70370-ZSWV,Raharimanana Tovo Miangaly,Antsiranana,School_30,non admis,passable,A1
54914-QTVW,Randrianarivelo Rina Hasina Mamy Andry,Antsiranana,School_34,admis,passable,A1
15315-UBBE,Rakotoarisoa Miangaly Finaritra,Farafangana,School_56,non admis,très bien,A2
38709-HAXR,Rakotomamonjy Tovo Finaritra Herilala Soa,Antananarivo,School_25,non admis,passable,A1
81105-SHSA,Rajaonarison Haja Finaritra Herilala,Toliara,School_53,non admis,très bien,A2
11030-HOXC,Raharimanana Tojo Herilala Tovo,Mahajanga,School_20,non admis,passable,A2
93068-CIDB,Randrianarivelo Miangaly Hery,Antananarivo,School_81,admis,bien,A2
64881-IZTD,Randrianarivelo Tojo Haja Hery,Mananjary,School_61,non admis,assez bien,A1
30826-ONMG,Rasolofo Soa Finaritra Hery Herilala,Toliara,School_17,admis,passable,A1
44198-NDFJ,Rakotoarisoa Soa Fitiavana Hasina,Ambatondrazaka,School_46,non admis,passable,A1
14418-EKPS,Rakotomamonjy Haja Hery Fanilo Hasina,Farafangana,School_82,non admis,passable,A1
83506-QJWJ,Andrianarivo Tovo Finaritra,Antananarivo,School_68,non admis,passable,A2
95470-SNMA,Rakotomamonjy Herilala Rina,Morondava,School_90,non admis,bien,A2
29160-ROKO,Rasolofo Finaritra Andry,Antsiranana,School_94,non admis,passable,A2
87649-WPOB,Raharinaivo Soa Tovo,Fianarantsoa,School_45,non admis,passable,A2
98555-VRON,Rakotoarisoa Hasina Mamy Fitiavana,Mahajanga,School_14,non admis,passable,S
40067-OKFE,Rasolofo Haja Finaritra,Mahajanga,School_6,non admis,passable,A1
96062-FUHP,Rajaonarison Rina Tovo Tojo Hery,Farafangana,School_81,non admis,passable,A2
55048-TTGN,Randrianarivelo Mamy Andry,Antsiranana,School_77,non admis,très bien,OSE
98379-NOSE,Raharimanana Tojo Mamy Fanilo,Antsirabe,School_69,non admis,assez bien,A1
90659-USGQ,Randria Mamy Haja Tiana Finaritra,Mahajanga,School_74,non admis,passable,S
94184-TTUZ,Rakotoarisoa Tiana Finaritra Hasina Mamy,Ambatondrazaka,School_79,admis,bien,A1
36059-SDSW,Rakotomamonjy Haja Rina Tiana Soa,Antananarivo,School_83,admis,passable,A2
40249-RBMI,Rasolofo Finaritra Soa,Ambatondrazaka,School_32,admis,bien,A1
13092-BWWL,Andrianarivo Hery Miangaly Soa,Fianarantsoa,School_79,non admis,passable,A2
70410-KGDD,Rakotoarisoa Miangaly Herilala Soa Rina,Mahajanga,School_71,non admis,passable,A2
23494-JSQY,Randria Herilala Andry Haja,Farafangana,School_90,non admis,passable,C
95486-QFUL,Rakotoarisoa Herilala Hery,Antsiranana,School_92,non admis,très bien,A2
90652-KZPW,Rajaonarison Fitiavana Finaritra Tojo Fanilo,Mahajanga,School_49,admis,passable,A2
76436-JMQO,Rasolofoson Andry Hery,Morondava,School_91,admis,passable,C
65427-DXYJ,Rakotoarisoa Hasina Herilala Hery,Antsiranana,School_10,admis,passable,A1
15844-YODU,Raharimanana Tovo Herilala,Toliara,School_71,admis,passable,A1
50005-HSWF,Andrianarivo Andry Hasina,Ambatondrazaka,School_64,non admis,passable,C
57045-BVTY,Andrianarivo Tojo Soa Miangaly Finaritra,Mahajanga,School_28,admis,passable,C
72535-JEWO,Rasolofoson Haja Fanilo Tojo,Antsirabe,School_65,non admis,passable,OSE
88721-XOBV,Rajaonarison Herilala Tojo,Toamasina,School_76,non admis,passable,C
58352-KMQG,Rakotomamonjy Fitiavana Rina Fanilo Tojo,Fianarantsoa,School_28,non admis,passable,OSE
16839-CUAA,Rakotomamonjy Mamy Haja,Antsiranana,School_75,non admis,passable,A2
21650-LSTJ,Rasolofo Tojo Hasina Andry,Farafangana,School_48,non admis,passable,L
55660-WMRL,Randrianarivelo Andry Hasina,Antsirabe,School_26,non admis,passable,A2
78318-EQWE,Rakotomamonjy Mamy Fanilo,Fianarantsoa,School_44,non admis,passable,A2
67837-CWGT,Rasolofoson Hery Tiana Fanilo Miangaly,Mananjary,School_61,admis,passable,D
42790-OFIW,Rajaonarison Mamy Fanilo Tojo,Toamasina,School_43,non admis,passable,A2
37512-HZSS,Rasolofoson Andry Hery Mamy Fitiavana,Antsiranana,School_32,non admis,passable,A2
81900-EMCG,Rasolofo Tovo Tiana Haja,Toamasina,School_53,non admis,assez bien,S
54455-MHXX,Andrianarivo Rina Fanilo,Antsiranana,School_8,admis,passable,L
44651-VNMZ,Randria Mamy Andry Miangaly,Farafangana,School_44,non admis,bien,A2
44138-NLXY,Raharinaivo Fitiavana Rina Hery Fanilo,Farafangana,School_4,non admis,assez bien,A2
28917-EYVU,Randria Fanilo Haja Herilala Rina,Antsiranana,School_81,admis,passable,OSE
13571-HTOG,Rakotomamonjy Haja Rina Tovo Miangaly,Antsiranana,School_80,non admis,passable,A1
64103-FIVZ,Rasolofo Soa Tovo,Mananjary,School_76,admis,passable,A2
39137-CYRX,Randrianarivelo Fitiavana Fanilo Tiana,Mananjary,School_25,admis,passable,A1
20339-YGNK,Rakotomamonjy Andry Finaritra Mamy Tojo,Fianarantsoa,School_78,non admis,très bien,A1
98978-WINQ,Raharimanana Fitiavana Fanilo,Fianarantsoa,School_40,non admis,passable,A1
58757-VMYS,Andrianarivo Mamy Hery Tovo,Toliara,School_77,non admis,passable,A2
23947-IQVG,Rakotomamonjy Tovo Fitiavana Miangaly Fanilo,Farafangana,School_16,non admis,passable,A1
42018-ECBV,Rasolofoson Hery Herilala,Fianarantsoa,School_47,non admis,passable,A2
76403-CCYT,Randria Herilala Rina Miangaly,Farafangana,School_1,non admis,passable,D
92668-JAHM,Randrianarivelo Hery Hasina Soa Haja,Morondava,School_15,non admis,passable,A2
14409-XYTI,Rajaonarison Fitiavana Herilala,Fianarantsoa,School_33,non admis,passable,A2
77820-PDNW,Raharimanana Rina Tojo,Mananjary,School_41,non admis,passable,A2
46230-UVDQ,Rakotomamonjy Soa Tiana Fitiavana Tojo,Mahajanga,School_63,non admis,passable,OSE
82519-ZPBM,Rakotoarisoa Soa Herilala Hasina,Toliara,School_42,non admis,passable,A1
57017-IGOS,Randria Tojo Mamy Herilala,Toamasina,School_23,non admis,passable,A1
39084-QEVC,Raharinaivo Tojo Hasina Tiana,Farafangana,School_72,non admis,passable,S
27832-TYSG,Raharinaivo Miangaly Herilala Finaritra Soa,Farafangana,School_57,admis,passable,D
34948-FTDE,Randrianarivelo Rina Finaritra,Antsirabe,School_4,non admis,passable,A2
91373-HBNA,Rajaonarison Hasina Fitiavana Mamy,Toliara,School_88,admis,passable,A2
22738-ZDPH,Rakotomamonjy Tojo Andry Hasina Hery,Antsirabe,School_87,non admis,passable,L
78431-GIZL,Rajaonarison Miangaly Tojo Haja,Toamasina,School_3,non admis,passable,A2
89963-BMWD,Randrianarivelo Hasina Fitiavana,Toliara,School_52,admis,passable,A1
13986-PYBP,Raharinaivo Tiana Andry Haja Soa,Toliara,School_53,admis,passable,D
80933-YSRG,Rakotoarisoa Tovo Soa Hery Tojo,Ambatondrazaka,School_41,non admis,passable,A2
54374-UJEG,Andrianarivo Fitiavana Fanilo Andry,Antsirabe,School_63,non admis,passable,C
90742-YJMI,Randrianarivelo Hasina Finaritra Soa Tojo,Toliara,School_52,admis,passable,A1
22976-QJOC,Randrianarivelo Rina Haja,Antsiranana,School_51,admis,passable,C
69967-NCKI,Andrianarivo Tiana Miangaly Andry,Antsiranana,School_41,non admis,passable,A2
68947-SBCK,Randrianarivelo Tojo Rina Finaritra Hasina,Antsirabe,School_65,non admis,passable,L
58809-JEZE,Raharimanana Hasina Andry Fanilo Fitiavana,Morondava,School_35,non admis,passable,A2
81681-RKUP,Rasolofoson Fitiavana Tiana Herilala,Fianarantsoa,School_23,non admis,bien,OSE
32535-RYSG,Rasolofoson Hasina Tiana,Morondava,School_50,non admis,passable,A1
83103-RLCW,Rajaonarison Hery Rina,Antananarivo,School_18,admis,passable,A1
55943-OHGP,Andrianarivo Hasina Hery Soa,Fianarantsoa,School_42,non admis,passable,A2
94287-NUGD,Rasolofo Miangaly Andry Tojo Mamy,Toliara,School_59,non admis,passable,D
91120-GZIY,Randria Mamy Hery Tovo Fanilo,Toamasina,School_90,admis,passable,A1
89793-ZYNQ,Rasolofo Rina Andry,Antsirabe,School_37,admis,passable,A1
59408-EVMS,Rasolofoson Soa Miangaly Herilala Finaritra,Farafangana,School_90,non admis,passable,A1
61383-OAEB,Raharinaivo Tovo Hery Soa,Antsiranana,School_85,admis,passable,A1
24170-VIAL,Rasolofo Tojo Andry,Mahajanga,School_45,non admis,passable,A1
51131-IPPH,Randrianarivelo Soa Andry,Fianarantsoa,School_45,non admis,passable,A2
22168-ZHUC,Rakotoarisoa Tojo Fitiavana Soa,Antsirabe,School_42,non admis,bien,A2
11802-FKAH,Raharinaivo Hery Miangaly,Toliara,School_85,non admis,passable,C
89380-BKKM,Randrianarivelo Hery Hasina Andry Herilala,Antsiranana,School_28,non admis,passable,A1
30097-RMXF,Rajaonarison Rina Andry Finaritra Fanilo,Farafangana,School_25,admis,passable,A2
53031-VVHN,Randria Rina Tojo Fanilo,Farafangana,School_92,non admis,passable,D
58273-ZPZQ,Rakotoarisoa Herilala Soa Tojo,Mahajanga,School_15,non admis,passable,OSE
20854-VQZT,Randrianarivelo Fitiavana Fanilo,Farafangana,School_70,admis,bien,OSE
45522-PVTU,Rasolofoson Hery Mamy,Mahajanga,School_100,non admis,passable,A1
53152-MZHU,Raharinaivo Tojo Haja Mamy Soa,Mananjary,School_21,non admis,très bien,A1
27515-TMXL,Rajaonarison Hery Herilala Andry Haja,Farafangana,School_7,admis,passable,A1
91537-ZLZF,Randrianarivelo Tiana Tovo Rina Finaritra,Morondava,School_32,admis,passable,A1
34141-HGOJ,Andrianarivo Tojo Soa,Fianarantsoa,School_15,admis,passable,L
96793-NXIP,Randria Rina Haja Herilala Hasina,Antsirabe,School_21,admis,bien,A1
37453-RWAG,Raharinaivo Mamy Finaritra,Fianarantsoa,School_5,non admis,passable,A2
68299-ZDOU,Rasolofo Mamy Hasina Fitiavana,Ambatondrazaka,School_18,non admis,bien,OSE
37778-ACWI,Rakotomamonjy Mamy Haja Tojo,Mahajanga,School_83,admis,passable,A2
29522-XUAQ,Rasolofo Mamy Soa,Antananarivo,School_6,admis,passable,A2
42858-GVIH,Randria Mamy Hasina Soa Hery,Mananjary,School_60,non admis,passable,S
82103-OZGL,Rasolofoson Mamy Tiana,Fianarantsoa,School_40,non admis,passable,A2
66009-DNFT,Raharimanana Hasina Haja Fitiavana,Mananjary,School_60,non admis,passable,C
16143-IAPS,Rajaonarison Hasina Tiana,Antsirabe,School_66,non admis,passable,A1
48620-RPUD,Raharinaivo Hery Fanilo Tojo Tiana,Mahajanga,School_75,non admis,passable,A1
24218-MVSX,Raharimanana Finaritra Soa Tojo Fitiavana,Fianarantsoa,School_5,non admis,assez bien,OSE
27959-YGJM,Rasolofo Herilala Soa Tovo Fitiavana,Antsiranana,School_12,admis,passable,A2
92879-XDMS,Rajaonarison Rina Fitiavana Hery,Mahajanga,School_84,admis,passable,A2
97251-UECH,Rakotoarisoa Andry Herilala Soa,Mahajanga,School_2,admis,passable,C
34438-SKCR,Rasolofoson Hasina Mamy Rina,Toamasina,School_96,non admis,passable,D
81735-NBDH,Raharinaivo Mamy Tovo Hery,Morondava,School_80,admis,passable,D
70569-YJQE,Andrianarivo Rina Haja Andry,Antananarivo,School_24,non admis,passable,A1
27850-BSCF,Andrianarivo Soa Tojo Herilala Hery,Farafangana,School_87,non admis,passable,D
95782-GBIT,Randria Fitiavana Rina Soa Haja,Farafangana,School_55,non admis,passable,A2
18158-AWVH,Andrianarivo Rina Hery,Fianarantsoa,School_62,admis,passable,A1
62340-ZRFG,Rasolofo Finaritra Haja Tojo Tiana,Toliara,School_8,admis,passable,A1
87324-DBZQ,Rasolofo Tiana Tojo Soa Andry,Toliara,School_49,non admis,passable,A2
84623-MIRR,Rakotomamonjy Haja Tojo Hasina,Mananjary,School_36,non admis,bien,A1
14545-ARQV,Rasolofoson Hery Tiana Mamy Fitiavana,Morondava,School_67,non admis,bien,D
73938-POPM,Randrianarivelo Haja Hasina Herilala Andry,Antananarivo,School_74,admis,passable,D
65804-EMIM,Rasolofoson Tiana Rina Finaritra,Morondava,School_73,admis,passable,A2
99624-ZQRE,Rakotomamonjy Hasina Tovo Hery Haja,Antsiranana,School_14,non admis,assez bien,A1
79058-ETJT,Rakotoarisoa Miangaly Rina Herilala,Toamasina,School_27,non admis,bien,A1
38697-SYIM,Raharinaivo Hasina Soa Miangaly,Antsirabe,School_38,non admis,bien,C
39825-ZVLZ,Rasolofo Tovo Herilala Fitiavana Tiana,Antsiranana,School_25,non admis,passable,OSE
38395-HSDW,Raharinaivo Haja Andry Rina,Toamasina,School_73,admis,passable,C
88430-HPLU,Rasolofo Mamy Soa,Mananjary,School_12,non admis,passable,A2
94160-NDXV,Rasolofo Finaritra Fanilo Mamy Herilala,Fianarantsoa,School_59,non admis,passable,A2
72794-QKBG,Raharinaivo Tojo Fanilo Haja,Fianarantsoa,School_67,non admis,passable,S
96779-VREI,Randrianarivelo Finaritra Mamy,Antananarivo,School_18,non admis,passable,A2
63137-NIHU,Rakotoarisoa Fitiavana Tiana Rina Andry,Ambatondrazaka,School_37,admis,passable,A1
29717-PJTQ,Rakotoarisoa Mamy Tiana,Morondava,School_48,non admis,passable,A1
93299-AMUC,Raharimanana Hasina Tojo Mamy Hery,Antananarivo,School_66,non admis,assez bien,OSE
44162-XZRR,Rakotoarisoa Tovo Rina Haja,Antananarivo,School_48,admis,passable,A2
59766-DTKM,Rasolofoson Finaritra Hery Tiana,Fianarantsoa,School_28,admis,passable,A1
38812-VDTB,Raharimanana Finaritra Miangaly Hery Fanilo,Antsirabe,School_38,admis,passable,A2
37969-HHGA,Rakotoarisoa Andry Haja Hery Herilala,Mahajanga,School_12,non admis,passable,C
31179-MYYZ,Randria Hasina Hery Soa,Fianarantsoa,School_10,non admis,passable,D
76141-ATXG,Andrianarivo Tiana Soa,Antsiranana,School_2,non admis,bien,A2
92002-FOSB,Rasolofoson Andry Tiana,Toamasina,School_48,admis,très bien,C
85876-RPZW,Rasolofo Hasina Rina Tiana Tovo,Toliara,School_32,non admis,bien,A1
66010-HSVA,Andrianarivo Rina Soa Andry,Toamasina,School_29,non admis,passable,D
17754-HPQS,Rasolofo Tojo Tiana Mamy Miangaly,Farafangana,School_93,admis,bien,A1
10680-KUIA,Rakotomamonjy Haja Fitiavana Tiana Andry,Ambatondrazaka,School_38,non admis,passable,A2
21613-NTSM,Andrianarivo Soa Haja Tojo Fitiavana,Ambatondrazaka,School_29,admis,passable,OSE
14726-JEYC,Raharimanana Tojo Haja Hery,Morondava,School_31,admis,passable,A1
77892-OPXP,Randria Tiana Herilala Andry,Toamasina,School_38,non admis,passable,D
89775-CLLH,Rasolofoson Herilala Miangaly Andry,Antsirabe,School_44,non admis,passable,A2
28915-ZQUQ,Rajaonarison Tojo Rina Tovo Hery,Mananjary,School_90,non admis,passable,A2
97325-TZFR,Rajaonarison Hery Herilala Fitiavana Hasina,Antsiranana,School_68,admis,assez bien,A1
68429-LWZA,Raharimanana Hasina Andry Finaritra Tovo,Farafangana,School_99,non admis,passable,A2
30497-VRGK,Rakotomamonjy Miangaly Hasina Mamy Tojo,Morondava,School_3,non admis,passable,A1
69357-FYXZ,Rasolofo Tovo Haja Soa,Farafangana,School_83,non admis,passable,A1
71213-LWQE,Randria Finaritra Rina,Toliara,School_14,non admis,passable,OSE
29533-SCSG,Randrianarivelo Miangaly Hasina Fitiavana Herilala,Toamasina,School_23,admis,passable,L
87735-CFOT,Randrianarivelo Soa Mamy,Morondava,School_52,non admis,passable,A1
95235-JDOR,Raharinaivo Soa Tovo Rina Mamy,Morondava,School_28,admis,passable,L
24157-JFBZ,Andrianarivo Haja Herilala Miangaly,Morondava,School_82,admis,passable,S
89429-OMTZ,Rakotomamonjy Fanilo Fitiavana Rina,Toliara,School_33,admis,passable,D
88073-CUAL,Raharinaivo Tojo Mamy Fitiavana,Antsiranana,School_69,non admis,passable,A2
20960-NHCS,Raharinaivo Soa Herilala Mamy Miangaly,Ambatondrazaka,School_69,admis,passable,OSE
40645-NAYH,Rasolofo Tojo Mamy Fitiavana Andry,Mananjary,School_77,non admis,passable,A1
62674-CDCK,Rakotoarisoa Andry Rina Hery,Antananarivo,School_1,admis,passable,A1
48191-ZJRU,Randria Hasina Fitiavana Mamy Andry,Farafangana,School_66,admis,passable,A2
84792-QTFL,Rajaonarison Finaritra Tovo Miangaly,Antsiranana,School_42,non admis,passable,A2
12214-HINX,Randrianarivelo Rina Soa,Morondava,School_1,admis,passable,A2
97914-GHVA,Rasolofo Soa Hery Hasina,Toliara,School_37,non admis,passable,A2
16700-WQYK,Randrianarivelo Miangaly Tiana,Toliara,School_61,non admis,passable,D
27931-FHUX,Randrianarivelo Fanilo Tovo Andry,Antananarivo,School_15,non admis,passable,OSE
19237-CRHK,Randrianarivelo Fitiavana Mamy,Antsiranana,School_93,non admis,passable,S
66560-GKYM,Raharinaivo Fitiavana Haja Tojo Herilala,Antsiranana,School_44,non admis,bien,A2
35694-ENBT,Andrianarivo Tojo Andry Mamy,Mananjary,School_53,admis,bien,OSE
16220-YEMW,Raharinaivo Mamy Soa Finaritra Miangaly,Morondava,School_23,non admis,passable,A1
34671-UEOJ,Rakotoarisoa Hery Tiana Mamy,Antsirabe,School_6,non admis,passable,A2
42386-AIVU,Rasolofo Andry Tojo Tiana,Toliara,School_32,non admis,passable,D
79483-LHJM,Rasolofo Herilala Mamy Tojo,Farafangana,School_45,non admis,passable,A2
26232-WAKX,Raharinaivo Hasina Fitiavana Mamy,Fianarantsoa,School_42,admis,assez bien,A1
24661-NYQI,Rasolofoson Finaritra Tovo,Fianarantsoa,School_27,non admis,passable,A2
23093-OHFS,Rasolofoson Finaritra Andry Soa Hery,Toliara,School_78,admis,passable,A1
38064-ZNQV,Randria Fanilo Haja Finaritra,Morondava,School_46,admis,passable,C
86342-XTFG,Rasolofoson Miangaly Tiana Tovo,Morondava,School_34,admis,passable,A1
21480-BCQF,Raharimanana Fitiavana Mamy Tiana Rina,Fianarantsoa,School_23,admis,passable,S
56362-VHRH,Randria Miangaly Hasina Mamy,Antananarivo,School_89,non admis,bien,D
35724-WKWQ,Andrianarivo Tiana Tojo Hasina Herilala,Toamasina,School_86,non admis,passable,A2
61711-JQMV,Rajaonarison Finaritra Hery Andry,Morondava,School_45,non admis,très bien,A1
89787-EBKZ,Rakotoarisoa Finaritra Fanilo Mamy Tovo,Toamasina,School_65,admis,passable,C
19661-TUWL,Andrianarivo Tovo Andry Fanilo Miangaly,Antsiranana,School_74,admis,passable,A2
87046-FPCE,Randria Finaritra Fanilo Tojo,Fianarantsoa,School_60,admis,passable,A1
77069-QUQZ,Andrianarivo Tovo Mamy Fanilo,Antananarivo,School_19,non admis,passable,A1
38531-OIJJ,Raharimanana Soa Tojo,Mahajanga,School_43,non admis,passable,OSE
90243-VUXC,Randria Hery Finaritra Hasina,Morondava,School_28,non admis,passable,S
74655-SONU,Andrianarivo Tiana Fanilo,Farafangana,School_16,admis,passable,A2
54203-ZAPX,Randrianarivelo Miangaly Mamy Tovo,Antsirabe,School_8,non admis,passable,C
20092-DRYZ,Randrianarivelo Tovo Finaritra Hery,Mananjary,School_19,non admis,passable,D
55278-QSNH,Randrianarivelo Haja Tojo Miangaly,Antsirabe,School_52,non admis,passable,A1
45693-GQFZ,Rasolofoson Tiana Fitiavana Soa Tojo,Morondava,School_93,non admis,passable,D
55882-EOSZ,Andrianarivo Fitiavana Finaritra Hery Fanilo,Toliara,School_48,admis,passable,D
35172-UKMU,Randrianarivelo Rina Tovo,Antsirabe,School_98,non admis,passable,A1
20675-ITZG,Rasolofo Mamy Andry Haja Finaritra,Farafangana,School_48,admis,passable,A2
71010-LWJN,Randria Soa Mamy,Morondava,School_84,admis,bien,A2
53184-ROLY,Raharinaivo Haja Tojo,Antsiranana,School_20,non admis,passable,A1
15102-OHTS,Raharinaivo Haja Fitiavana Finaritra,Ambatondrazaka,School_47,non admis,passable,A2
83131-OYDH,Rakotomamonjy Haja Finaritra Hery,Mananjary,School_2,admis,passable,A1
54076-BNQT,Rakotomamonjy Tiana Soa Herilala Haja,Morondava,School_77,admis,bien,S
42777-CHPC,Rasolofoson Finaritra Fanilo Tojo Miangaly,Mahajanga,School_73,non admis,passable,A1
32051-XKPK,Randria Tovo Fitiavana Fanilo Finaritra,Toliara,School_52,admis,passable,A1
62371-DQAO,Raharimanana Miangaly Tovo,Antsiranana,School_3,admis,passable,C
39818-IESI,Rakotomamonjy Miangaly Hery,Antananarivo,School_2,non admis,passable,L
55299-VQNS,Rajaonarison Hery Finaritra Tiana Hasina,Farafangana,School_60,non admis,passable,D
59136-YZQV,Raharimanana Tiana Haja Finaritra,Morondava,School_67,admis,passable,A1
67358-HBNW,Raharinaivo Fanilo Tiana,Morondava,School_17,non admis,passable,A2
99651-XYNR,Rakotomamonjy Rina Haja,Mananjary,School_81,non admis,très bien,A1
38443-FLBY,Randria Tiana Fanilo Herilala Miangaly,Toliara,School_4,non admis,passable,A1
22377-AWQV,Randrianarivelo Soa Miangaly,Mananjary,School_46,non admis,passable,A2
62899-BZXC,Rajaonarison Mamy Tovo,Fianarantsoa,School_81,admis,passable,S
57127-ENIE,Randrianarivelo Mamy Andry Tiana,Morondava,School_79,admis,passable,A1
13749-SYCP,Rasolofoson Haja Tiana Rina,Farafangana,School_76,admis,passable,A1
75303-NVPM,Rakotoarisoa Herilala Haja,Fianarantsoa,School_33,admis,passable,A2
24053-LJCV,Rasolofoson Haja Hery,Fianarantsoa,School_68,non admis,passable,A1
49352-IBUI,Rakotoarisoa Hasina Tojo Miangaly,Mahajanga,School_1,admis,très bien,A2
39081-OMLU,Andrianarivo Herilala Fanilo,Farafangana,School_39,admis,passable,C
73738-PDIQ,Rasolofo Fanilo Hery,Antananarivo,School_3,non admis,passable,A2
65429-MDEE,Andrianarivo Herilala Tojo Tovo Rina,Mananjary,School_83,admis,passable,D
62154-NSHO,Raharinaivo Rina Hery Andry Tovo,Antsirabe,School_79,admis,passable,A1
77704-XJUS,Rakotoarisoa Tovo Fanilo,Antsiranana,School_66,admis,passable,A1
67572-CXKO,Rakotoarisoa Mamy Tojo Fitiavana,Mananjary,School_32,non admis,passable,D
24120-LJHD,Rakotomamonjy Tiana Tojo Miangaly Finaritra,Ambatondrazaka,School_3,admis,passable,D
46986-CLPJ,Raharinaivo Haja Miangaly Andry Fitiavana,Antsiranana,School_84,non admis,passable,A2
54056-YZRC,Rakotoarisoa Tiana Finaritra Haja,Toliara,School_67,admis,passable,OSE
31950-BIMF,Rasolofo Fitiavana Fanilo Tiana,Antsirabe,School_99,admis,bien,A2
93294-TIDB,Rakotoarisoa Andry Soa,Mahajanga,School_51,admis,très bien,A1
46680-GCBO,Rakotomamonjy Hasina Fitiavana Tojo,Farafangana,School_42,non admis,passable,A2
12305-LHWN,Randria Andry Hasina,Toliara,School_6,admis,passable,A2
90425-XOVQ,Randrianarivelo Fanilo Finaritra,Antsirabe,School_55,admis,passable,D
11777-PTFL,Raharimanana Fanilo Mamy Andry,Toliara,School_41,non admis,passable,S
48257-FOHY,Randria Herilala Finaritra Mamy,Antsiranana,School_52,non admis,passable,A1
22168-UHEQ,Andrianarivo Tovo Fitiavana,Antsirabe,School_69,admis,très bien,A1
79924-EIYH,Andrianarivo Tojo Rina Hasina,Morondava,School_30,non admis,passable,A1
60063-ZEWW,Raharimanana Fitiavana Soa,Farafangana,School_67,non admis,passable,A2
93245-TQCP,Andrianarivo Tiana Tojo,Fianarantsoa,School_71,admis,passable,A1
85943-OJEU,Randria Rina Hasina Herilala Fanilo,Mahajanga,School_65,admis,passable,A1
83548-HXVQ,Rakotoarisoa Mamy Rina,Antsiranana,School_79,admis,passable,A2
27626-TPKL,Rakotomamonjy Finaritra Herilala,Mananjary,School_74,admis,passable,A1
64536-NWJG,Andrianarivo Soa Miangaly Haja,Toamasina,School_46,admis,passable,A2
24219-ZQJN,Rasolofoson Hasina Soa,Mahajanga,School_21,admis,passable,A2
95784-TZDX,Rakotomamonjy Miangaly Rina Tovo,Mahajanga,School_23,non admis,assez bien,A2
38150-DYJG,Rakotoarisoa Tovo Rina,Antananarivo,School_29,non admis,passable,A1
60999-IPIJ,Raharinaivo Tiana Miangaly Fitiavana,Antsiranana,School_36,non admis,passable,A2
18042-UUCU,Rakotoarisoa Tiana Herilala Hery Fitiavana,Ambatondrazaka,School_34,non admis,très bien,C
52513-NPZD,Rakotomamonjy Soa Andry Miangaly,Toamasina,School_52,admis,passable,S
75376-JYSO,Rajaonarison Miangaly Hery,Antananarivo,School_25,admis,passable,L
78197-DCKB,Rasolofoson Fitiavana Soa Herilala,Farafangana,School_30,non admis,très bien,D
94054-WWVF,Rakotoarisoa Andry Mamy Herilala Tojo,Ambatondrazaka,School_63,non admis,passable,A2
49360-TKNS,Rasolofoson Haja Herilala Hasina,Antsirabe,School_87,admis,bien,A1
51995-QEMG,Rasolofo Andry Miangaly Hery,Ambatondrazaka,School_34,non admis,passable,A2
26664-CEQV,Rakotomamonjy Fitiavana Hery Finaritra Soa,Mahajanga,School_20,admis,passable,A2
95815-QNTD,Raharimanana Hery Soa Tovo,Toliara,School_75,admis,passable,A2
17191-FPKN,Rajaonarison Mamy Herilala Tiana,Farafangana,School_49,non admis,passable,C
23823-PEGJ,Andrianarivo Tojo Finaritra Tovo Soa,Antananarivo,School_9,non admis,bien,A2
61905-CXGC,Randrianarivelo Fanilo Andry Herilala,Morondava,School_84,non admis,passable,A2
27773-CYSS,Andrianarivo Hasina Mamy,Toliara,School_19,non admis,passable,A1
76925-LDMG,Raharimanana Mamy Finaritra Andry,Antananarivo,School_48,admis,bien,A1
82579-MVZC,Rakotoarisoa Miangaly Fanilo Fitiavana Soa,Mahajanga,School_92,admis,passable,A1
45163-NIHT,Rasolofoson Tojo Andry Hasina Herilala,Antsiranana,School_64,admis,bien,A2
94046-XUVG,Rakotomamonjy Tovo Fitiavana Herilala Soa,Ambatondrazaka,School_18,admis,passable,OSE
44316-BNYC,Raharinaivo Tojo Tovo Haja Hasina,Antananarivo,School_84,non admis,passable,OSE
44118-ZBBI,Raharinaivo Rina Hasina Tovo,Mananjary,School_74,non admis,passable,A1
85010-RYLY,Rasolofo Rina Andry Herilala Hery,Toliara,School_19,non admis,passable,D
44667-GAKS,Rakotomamonjy Miangaly Andry Hasina Soa,Mananjary,School_50,non admis,passable,A1
64062-HXHT,Rasolofoson Soa Fanilo,Antsirabe,School_85,non admis,passable,D
80119-KSHL,Rasolofo Finaritra Tiana Mamy,Antsirabe,School_71,non admis,passable,A1
14240-WAJF,Andrianarivo Haja Miangaly Andry Soa,Farafangana,School_36,admis,passable,A2
98439-BGLO,Rakotomamonjy Fanilo Mamy,Farafangana,School_8,admis,assez bien,OSE
46942-YXZB,Andrianarivo Fitiavana Herilala Hasina,Antsiranana,School_8,admis,passable,A1
63119-VFPJ,Rajaonarison Andry Tovo Finaritra,Toliara,School_14,admis,passable,A1
